{
  "$schema": "http://json-schema.org/draft-07/schema#",
  "title": "Place",
  "type": "object",
  "required": [
    "name",
    "address",
    "lat",
    "lng",
    "wifi",
    "power",
    "seat_count",
    "open_hours",
    "url",
    "restroom"
  ],
  "properties": {
    "name": {
      "type": "string",
      "description": "장소 이름"
    },
    "description": {
      "type": "string",
      "description": "장소 설명"
    },
    "address": {
      "type": "string",
      "description": "도로명 주소 또는 지번 주소"
    },
    "lat": {
      "type": "number",
      "description": "위도 (Latitude)"
    },
    "lng": {
      "type": "number",
      "description": "경도 (Longitude)"
    },
    "wifi": {
      "type": "string",
      "enum": ["느림", "보통", "빠름"],
      "description": "와이파이 속도"
    },
    "power": {
      "type": "string",
      "enum": ["적음", "보통", "많음"],
      "description": "콘센트 수"
    },
    "seat_count": {
      "type": "string",
      "enum": ["적음", "보통", "넉넉함"],
      "description": "좌석 수"
    },
    "open_hours": {
      "type": "string",
      "description": "영업 시간 (예: '09:00 - 22:00')",
      "pattern": "^\\d{2}:\\d{2} - \\d{2}:\\d{2}$"
    },
    "url": {
      "type": "string",
      "description": "웹사이트나 블로그 링크",
      "format": "uri"
    },
    "restroom": {
      "type": "string",
      "description": "화장실 상태 (ex: '실내/남녀 구분')"
    },
    "images": {
      "type": "array",
      "description": "카페 사진 URL 목록",
      "items": {
        "type": "string",
        "format": "uri"
      }
    }
  },
  "additionalProperties": false
}
