[
  {
    "name": "건축가의 서재",
    "description": "매장도 넓고 조용하고 집중하기 좋은 용인 무인카페.",
    "address": "흥덕2로75번길 29-8",
    "wifi": "빠름",
    "power": "보통",
    "seat_count": "보통",
    "open_hours": "00:00 - 23:59",
    "url": "https://naver.me/F6lTUhYM",
    "restroom": "실내/남녀 구분",
    "images": [],
    "lat": 37.2740688117767,
    "lng": 127.070491899511
  }
]
